{
  "actions": [
    {
      "action_id": "confirm_prompt",
      "canonical_review_text": "Yes, that is what I mean.",
      "emphasis": "PRIMARY",
      "enabled": true,
      "kind": "SEMANTIC_MESSAGE",
      "label": "Confirm prompt",
      "ordinal": 1
    },
    {
      "action_id": "change_task",
      "emphasis": "NORMAL",
      "enabled": true,
      "kind": "FREE_RESPONSE_FOCUS",
      "label": "Change the task",
      "ordinal": 2
    },
    {
      "action_id": "change_approach",
      "emphasis": "NORMAL",
      "enabled": true,
      "kind": "FREE_RESPONSE_FOCUS",
      "label": "Change approach",
      "ordinal": 3
    },
    {
      "action_id": "something_else",
      "emphasis": "NORMAL",
      "enabled": true,
      "kind": "FREE_RESPONSE_FOCUS",
      "label": "Something else...",
      "ordinal": 4
    }
  ],
  "artifact": {
    "artifact_kind": "prompt",
    "artifact_ref": "prompt:I-7f8744c58d-P2",
    "artifact_revision": "6aa8263f087cacd984bd20610b5bd8d38669ca143e3f4c9f083488b66d95e3d7",
    "body": "COMPARE Kafka and RabbitMQ for event delivery for an audience of data engineers.",
    "capabilities": {
      "copy": true,
      "open_external": true
    },
    "media_type": "text/plain",
    "title": "Authoritative Prompt (PDL.md)"
  },
  "focus_kind": "PROMPT_REVIEW",
  "interaction_state": "REVIEW_REQUIRED",
  "lifecycle": {
    "authorized_handoff_artifacts": [],
    "close_allowed": true,
    "handoff_ready": false,
    "result_body": null,
    "review_required": true,
    "terminal": false,
    "terminal_disposition": null
  },
  "model_response": "Prompt Pseudocode\n\nCOMPARE Kafka and RabbitMQ for event delivery for an audience of data engineers.\n\nConfirm or correct this interpretation.",
  "model_revision": "3761bde341c58346611a4d308273000d6ed6bba7d12b9d481f71bc721270185c",
  "projection_id": "projection-fa9814e8084b2219043130014555058cf930daffc87447c1582d160d5f9e6ac3",
  "schema_version": "r6o-focus-projection-1",
  "session_id": "I-7f8744c58d",
  "stage": "PROMPT_REVIEW",
  "workspace_id": "W-171e48fa6cbd"
}
