{
  "actions": [
    {
      "action_id": "confirm_prompt",
      "canonical_review_text": "Yes, that is what I mean.",
      "emphasis": "PRIMARY",
      "enabled": true,
      "kind": "SEMANTIC_MESSAGE",
      "label": "Confirm prompt",
      "ordinal": 1
    },
    {
      "action_id": "change_task",
      "emphasis": "NORMAL",
      "enabled": true,
      "kind": "FREE_RESPONSE_FOCUS",
      "label": "Change the task",
      "ordinal": 2
    },
    {
      "action_id": "change_approach",
      "emphasis": "NORMAL",
      "enabled": true,
      "kind": "FREE_RESPONSE_FOCUS",
      "label": "Change approach",
      "ordinal": 3
    },
    {
      "action_id": "something_else",
      "emphasis": "NORMAL",
      "enabled": true,
      "kind": "FREE_RESPONSE_FOCUS",
      "label": "Something else...",
      "ordinal": 4
    }
  ],
  "artifact": {
    "artifact_kind": "prompt",
    "artifact_ref": "prompt:I-f3ecdbd3ec-P1",
    "artifact_revision": "c8939842847df371a9f0d828c585eaef1520fbc698c3f42be48c6cca1f0278a2",
    "body": "COMPARE Kafka and RabbitMQ for event delivery.",
    "capabilities": {
      "copy": true,
      "open_external": true
    },
    "media_type": "text/plain",
    "title": "Authoritative Prompt (PDL.md)"
  },
  "focus_kind": "PROMPT_REVIEW",
  "interaction_state": "REVIEW_REQUIRED",
  "lifecycle": {
    "authorized_handoff_artifacts": [],
    "close_allowed": true,
    "handoff_ready": false,
    "result_body": null,
    "review_required": true,
    "terminal": false,
    "terminal_disposition": null
  },
  "model_response": "Prompt Pseudocode\n\nCOMPARE Kafka and RabbitMQ for event delivery.\n\nConfirm or correct this interpretation.",
  "model_revision": "fd796d6e8be465dcd57da93e73a3357072c06b9167403626d34b4f35179e2c88",
  "projection_id": "projection-544e696a70d295bab707eba1dba5d425e3a490fba9fd11f5834235b37b651550",
  "schema_version": "r6o-focus-projection-1",
  "session_id": "I-f3ecdbd3ec",
  "stage": "PROMPT_REVIEW",
  "workspace_id": "W-0125be9284e6"
}
