{
  "actions": [
    {
      "action_id": "confirm_prompt",
      "canonical_review_text": "Yes, that is what I mean.",
      "emphasis": "PRIMARY",
      "enabled": true,
      "kind": "SEMANTIC_MESSAGE",
      "label": "Confirm prompt",
      "ordinal": 1
    },
    {
      "action_id": "change_task",
      "emphasis": "NORMAL",
      "enabled": true,
      "kind": "FREE_RESPONSE_FOCUS",
      "label": "Change the task",
      "ordinal": 2
    },
    {
      "action_id": "change_approach",
      "emphasis": "NORMAL",
      "enabled": true,
      "kind": "FREE_RESPONSE_FOCUS",
      "label": "Change approach",
      "ordinal": 3
    },
    {
      "action_id": "something_else",
      "emphasis": "NORMAL",
      "enabled": true,
      "kind": "FREE_RESPONSE_FOCUS",
      "label": "Something else...",
      "ordinal": 4
    }
  ],
  "artifact": {
    "artifact_kind": "prompt",
    "artifact_ref": "prompt:I-978e26d065-P1",
    "artifact_revision": "1f0202d278d5bc60f4465b6940a62b6460951341bf1a102da133896165601649",
    "body": "Explain the difference between optimistic locking and pessimistic locking for an audience of senior developers.",
    "capabilities": {
      "copy": true,
      "open_external": true
    },
    "media_type": "text/plain",
    "title": "Authoritative Prompt (PDL.md)"
  },
  "focus_kind": "PROMPT_REVIEW",
  "interaction_state": "REVIEW_REQUIRED",
  "lifecycle": {
    "authorized_handoff_artifacts": [],
    "close_allowed": true,
    "handoff_ready": false,
    "result_body": null,
    "review_required": true,
    "terminal": false,
    "terminal_disposition": null
  },
  "model_response": "Prompt Pseudocode\n\nExplain the difference between optimistic locking and pessimistic locking for an audience of senior developers.\n\nConfirm or correct this interpretation.",
  "model_revision": "1a5c2b8803ec7579c7e8537908a47755547b1fc20e2f6a48784107ee47cdedcb",
  "projection_id": "projection-b8a40b86df0e9ac0f020136b5055e8687065805c8c121e4fd4b53d0c85f13238",
  "schema_version": "r6o-focus-projection-1",
  "session_id": "I-978e26d065",
  "stage": "PROMPT_REVIEW",
  "workspace_id": "W-2a19531ec79a"
}
