{
  "actions": [],
  "artifact": null,
  "focus_kind": "CLOSED",
  "interaction_state": "TERMINAL",
  "lifecycle": {
    "authorized_handoff_artifacts": [
      {
        "artifact_kind": "prompt",
        "artifact_ref": "prompt:I-72757393dd-P2",
        "artifact_revision": "28cab64c890e7c23e22ec58473b90a5a284cd8fb2140b1c675cb4af3c72c502e",
        "body": "COMPARE Kafka and RabbitMQ for event delivery for an audience of data engineers.",
        "capabilities": {
          "copy": true,
          "open_external": true
        },
        "media_type": "text/plain",
        "title": "Authoritative Prompt (PDL.md)"
      },
      {
        "artifact_kind": "plan",
        "artifact_ref": "plan:I-72757393dd-R1",
        "artifact_revision": "b340ca4317b1bf90632848484860fde07d3c16fa81638f1083d6b7808dc0f739",
        "body": "IDENTIFY comparison criteria relevant to event delivery and data engineers.\nCOMPARE Kafka and RabbitMQ consistently across those criteria.\nSUMMARIZE the tradeoffs and the conditions that affect suitability.",
        "capabilities": {
          "copy": true,
          "open_external": true
        },
        "media_type": "text/plain",
        "title": "Authoritative Response Plan (PDL.md)"
      }
    ],
    "close_allowed": true,
    "handoff_ready": true,
    "result_body": "Kafka and RabbitMQ solve different event-delivery problems.\n\nKafka is a distributed event-streaming platform built around durable, partitioned logs. Consumers independently track offsets, so events can be retained and replayed. It is generally the stronger choice for data pipelines, stream processing, event sourcing, CDC, and high-throughput integration where multiple consumer groups need the same history.\n\nRabbitMQ is a message broker built around exchanges and queues. It supports flexible routing, acknowledgments, retries, priorities, and per-message delivery patterns. It is generally the stronger choice for task queues, commands, request/reply workflows, and operational messaging where messages should be routed to specific consumers and removed after successful processing.\n\nKey tradeoffs:\n\n- Delivery model: Kafka consumers pull from partitioned logs; RabbitMQ pushes or dispatches messages from queues.\n- Retention and replay: Kafka retains events according to time or size policies and supports straightforward replay. RabbitMQ normally removes acknowledged messages; replay requires additional design.\n- Ordering: Kafka guarantees ordering within a partition. RabbitMQ queues are ordered in principle, but redelivery, priorities, and multiple consumers can alter observed processing order.\n- Scaling: Kafka scales throughput through partitions and consumer groups, but partition count and key selection affect parallelism. RabbitMQ scales consumers easily for work distribution, while very large backlogs and extreme sustained throughput require more careful queue topology.\n- Routing: RabbitMQ provides rich exchange-based routing, including direct, topic, fanout, and header rules. Kafka routing is primarily topic-and-partition based.\n- Failure handling: RabbitMQ has native acknowledgment, dead-lettering, expiration, and retry-oriented features. Kafka typically implements retries and dead-letter topics through consumer or stream-processing logic.\n- Processing guarantees: Both commonly provide at-least-once delivery. Kafka can support effectively-once or transactional processing within compatible Kafka workflows, but end-to-end exactly-once behavior still depends on external systems and application design.\n- Operational fit: Kafka brings durable history and a broad data-streaming ecosystem but requires deliberate partition, retention, and consumer-lag management. RabbitMQ is often simpler for conventional messaging but requires careful handling of queue depth, acknowledgments, and poison messages.\n\nFor data engineers, choose Kafka when events are reusable data products, replay matters, throughput is high, or analytics and stream-processing systems need independent consumption. Choose RabbitMQ when the primary need is reliable work assignment, sophisticated routing, low-latency commands, or explicit per-message retry behavior. Many platforms use both: Kafka as the durable event backbone and RabbitMQ for operational task or command delivery.",
    "review_required": false,
    "terminal": true,
    "terminal_disposition": "HOST_HANDOFF"
  },
  "model_response": "Kafka and RabbitMQ solve different event-delivery problems.\n\nKafka is a distributed event-streaming platform built around durable, partitioned logs. Consumers independently track offsets, so events can be retained and replayed. It is generally the stronger choice for data pipelines, stream processing, event sourcing, CDC, and high-throughput integration where multiple consumer groups need the same history.\n\nRabbitMQ is a message broker built around exchanges and queues. It supports flexible routing, acknowledgments, retries, priorities, and per-message delivery patterns. It is generally the stronger choice for task queues, commands, request/reply workflows, and operational messaging where messages should be routed to specific consumers and removed after successful processing.\n\nKey tradeoffs:\n\n- Delivery model: Kafka consumers pull from partitioned logs; RabbitMQ pushes or dispatches messages from queues.\n- Retention and replay: Kafka retains events according to time or size policies and supports straightforward replay. RabbitMQ normally removes acknowledged messages; replay requires additional design.\n- Ordering: Kafka guarantees ordering within a partition. RabbitMQ queues are ordered in principle, but redelivery, priorities, and multiple consumers can alter observed processing order.\n- Scaling: Kafka scales throughput through partitions and consumer groups, but partition count and key selection affect parallelism. RabbitMQ scales consumers easily for work distribution, while very large backlogs and extreme sustained throughput require more careful queue topology.\n- Routing: RabbitMQ provides rich exchange-based routing, including direct, topic, fanout, and header rules. Kafka routing is primarily topic-and-partition based.\n- Failure handling: RabbitMQ has native acknowledgment, dead-lettering, expiration, and retry-oriented features. Kafka typically implements retries and dead-letter topics through consumer or stream-processing logic.\n- Processing guarantees: Both commonly provide at-least-once delivery. Kafka can support effectively-once or transactional processing within compatible Kafka workflows, but end-to-end exactly-once behavior still depends on external systems and application design.\n- Operational fit: Kafka brings durable history and a broad data-streaming ecosystem but requires deliberate partition, retention, and consumer-lag management. RabbitMQ is often simpler for conventional messaging but requires careful handling of queue depth, acknowledgments, and poison messages.\n\nFor data engineers, choose Kafka when events are reusable data products, replay matters, throughput is high, or analytics and stream-processing systems need independent consumption. Choose RabbitMQ when the primary need is reliable work assignment, sophisticated routing, low-latency commands, or explicit per-message retry behavior. Many platforms use both: Kafka as the durable event backbone and RabbitMQ for operational task or command delivery.",
  "model_revision": "c8d339c72eea2b831fd1dc5a11dfaccac3472026effde9c8c40471b0e4fea7fb",
  "projection_id": "projection-c35c67c8f6dc351fa1cd4b3ddf04e21e1a437cfe89666203f44130f898ed8b19",
  "schema_version": "r6o-focus-projection-1",
  "session_id": "I-72757393dd",
  "stage": "CLOSED_SUCCESS",
  "workspace_id": "W-5dd78fb1ebe1"
}
