{
  "actions": [
    {
      "action_id": "confirm_plan",
      "canonical_review_text": "Confirm the plan and execute.",
      "emphasis": "PRIMARY",
      "enabled": true,
      "kind": "SEMANTIC_MESSAGE",
      "label": "Confirm plan",
      "ordinal": 1
    },
    {
      "action_id": "change_task",
      "emphasis": "NORMAL",
      "enabled": true,
      "kind": "FREE_RESPONSE_FOCUS",
      "label": "Change the task",
      "ordinal": 2
    },
    {
      "action_id": "change_approach",
      "emphasis": "NORMAL",
      "enabled": true,
      "kind": "FREE_RESPONSE_FOCUS",
      "label": "Change approach",
      "ordinal": 3
    },
    {
      "action_id": "something_else",
      "emphasis": "NORMAL",
      "enabled": true,
      "kind": "FREE_RESPONSE_FOCUS",
      "label": "Something else...",
      "ordinal": 4
    }
  ],
  "artifact": {
    "artifact_kind": "plan",
    "artifact_ref": "plan:I-f0ccc38ac9-R1",
    "artifact_revision": "dc59ef99113453deae2c6896bc4c20261af52b125107dc585f20ea3ed48a9b37",
    "body": "IDENTIFY the target audience as senior developers\nINTRODUCE the subject of concurrency control\nDEFINE optimistic locking\nDEFINE pessimistic locking\nCOMPARE the two approaches\nSUMMARIZE the differences",
    "capabilities": {
      "copy": true,
      "open_external": true
    },
    "media_type": "text/plain",
    "title": "Authoritative Response Plan (PDL.md)"
  },
  "focus_kind": "PLAN_REVIEW",
  "interaction_state": "REVIEW_REQUIRED",
  "lifecycle": {
    "authorized_handoff_artifacts": [],
    "close_allowed": true,
    "handoff_ready": false,
    "result_body": null,
    "review_required": true,
    "terminal": false,
    "terminal_disposition": null
  },
  "model_response": "Response Plan Pseudocode\n\nIDENTIFY the target audience as senior developers\nINTRODUCE the subject of concurrency control\nDEFINE optimistic locking\nDEFINE pessimistic locking\nCOMPARE the two approaches\nSUMMARIZE the differences\n\nConfirm or correct this response approach.",
  "model_revision": "ac212139476f5bbcca92e0cfab012006726b3542a793450f559c9e6a76edaced",
  "projection_id": "projection-0001d252c63a756d82c944dc3cdd5192ab82a458d9d28c0261995c22ef4c3c37",
  "schema_version": "r6o-focus-projection-1",
  "session_id": "I-f0ccc38ac9",
  "stage": "PLAN_REVIEW",
  "workspace_id": "W-fb1daf56de63"
}
